{
  "id": "template-pack",
  "name": "Corestack Template Pack",
  "version": "0.1.0",
  "description": "Reference-only template showing the Corestack pack contract.",
  "required_corestack_version": ">=0.1.0",
  "ports": {
    "offset_required": true,
    "exposed": [
      "TEMPLATE_HTTP_PORT"
    ]
  },
  "services": [
    "template-web: placeholder HTTP endpoint"
  ]
}
